,Case Number,Date,Type,Country,Area,Activity,Injury,Fatal (Y/N)
4500,1942.00.00.d,1942,Sea Disaster,MID-PACIFC OCEAN,(Southwestern Pacific),"Plane forced down, 3 men on rubber life raft. Put hand over side to feel drift of boat ","Fingers badly lacerated, wounds became septic",N
4501,1942.00.00.c,1942,Sea Disaster,SOUTHWEST PACIFIC OCEAN,,Ditched plane in the sea & were adrift on a rubber life raft. ,"No injury to occupants, They fought off sharks & killed one with an automatic. Rescued 34 days later",N
4502,1942.00.00.b,1942,Boating,,,"Days before the surrender of Singapore, the 3 men escaped to Sumatra where they acquired a 17' dinghy. After 125 days at sea they drifted back to Sumatra","No injury to occupants. Sharks continually followed the dinghy, and one smashed its rudder ",N
4503,1942.00.00.a,1942,Unprovoked,PANAMA,Panama City,Swimming,"FATAL, body not recovered",Y
4504,1941.12.07,07-Dec-41,Sea Disaster,SOUTH ATLANTIC OCEAN,,Torpedoed & burning British  light cruiser with a crew of 450 men,"Only 170 survived, many of the crew were said to have been taken by sharks",Y
4505,1941.12.03,03-Dec-41,Unprovoked,AUSTRALIA,Western Australia,Swimming,Right ankle bitten,N
4506,1941.11.27.b,27-Nov-41,Sea Disaster,SOUTH ATLANTIC OCEAN,Off Libya,HMAS Parramatta torpedoed & sunk by the U-559,Right hand severed,N
4507,1941.11.27.a,27-Nov-41,Sea Disaster,SOUTH ATLANTIC OCEAN,Off Libya,HMAS Parramatta torpedoed & sunk by the U-559,Lacerations to chest,N
4508,1941.11.24,25-Nov-41,Sea Disaster,SOUTH ATLANTIC OCEAN,"North of Pernambuco, Brazil",British cruiser Dunedin torpedoed & sunk by the U-124,"418 perished, only 67 survived, some of the men were taken by sharks",Y
4509,1941.11.19,19-Nov-41,Sea Disaster,AUSTRALIA,Western Australia,German raider Kormoran was sunk in an engagement with HMAS Sydney,Leg bitten,N
4510,1941.09.25,25-Sep-41,Unprovoked,CARIBBEAN SEA,,SS Ethel Skakel foundered in Central America Hurricane of 1941,Leg lacerated FATAL,Y
4511,1941.08.21.R,Reported 21-Aug-1941,Provoked,USA,New York,Fishing,Laceration to left forearm from hooked shark PROVOKED INCIDENT,N
4512,1941.08.05,05-Aug-41,Invalid,AUSTRALIA,New South Wales,Swimming,Shark involvement prior to death unconfirmed,Y
4513,1941.08.01,01-Aug-41,Unprovoked,USA,South Carolina,Swimming at edge of channel,Chest lacerated,N
4514,1941.07.22,22-Jul-41,Boating,USA,New Jersey,Fishing for tuna,"No injury to occupants, shark leapt into boat & bit cabin door",N
4515,1941.07.01,01-Jul-41,Provoked,USA,Hawaii,Fishing,Arm bitten while removing shark from fishing line PROVOKED INCIDENT,N
4516,1941.06.15,15-Jun-41,Provoked,USA,New York,Fishing from 32' boat,Left hand bitten as he tried to put rope around shark's tail PROVOKED INCIDENT,N
4517,1941.06.00,Jun-41,Sea Disaster,PACIFIC OCEAN,Off coast of Ecuador,"Ditched aircraft, 3 men in the water. Swam for 31 hours","1 man survived & was rescued, sharks took the corpses of the two men that perished",Y
4518,1941.03.24,24-Mar-41,Sea Disaster,SOUTH ATLANTIC OCEAN,,The troopship Britannia was sunk by the German raider Thor,Dr. A.R. Hernandez of ship Cabo Hornos treated passenger whose leg was severed by a shark,N
4519,1941.03.09,09-Mar-41,Provoked,USA,California,Fishing,Right hand bitten by boated shark PROVOKED INCIDENT,N
4520,1941.02.13.,13-Feb-41,Provoked,AUSTRALIA,New South Wales,Fishing,Hand lacerated by hooked shark PROVOKED INCIDENT,N
4521,1941.02.01,01-Feb-41,Provoked,JAMAICA,Trelawney Province,Seine netting,"Left knee, calf & heel bitten by shark trapped in the net PROVOKED INCIDENT",N
4522,1941.01.29,29-Jan-41,Unprovoked,SOUTH ATLANTIC OCEAN,In Convoy OB 274,Rescuing seaman after ship sunk by German raider,Clothing torn by sharks,N
4523,1941.01.00,Jan-41,Sea Disaster,ATLANTIC OCEAN,,Adrift on raft after their ship was sunk by an Axis raider ,FATAL,Y
4524,1941.00.00.h,1941,Unprovoked,SOLOMON ISLANDS,New Georgia,Floating,Buttock bitten,N
4525,1941.00.00.f,1941,Unprovoked,IRAN,Khuzestan Province,Standing,FATAL,Y
4526,1941.00.00.e,1941,Unprovoked,IRAN,Khuzestan Province,,FATAL,Y
4527,1941.00.00.d,1941,Unprovoked,IRAN,Khuzestan Province,,"Survived, but suffered a forequarter amputation",N
4528,1941.00.00.c,1941,Unprovoked,IRAN,Khuzestan Province,Slipped off rocks and fell into the water,"FATAL, both arms bitten ",Y
4529,1941.00.00.b,1941,Unprovoked,IRAN,Khuzestan Province,Standing,FATAL,Y
4530,1941.00.00.a,1941,Unprovoked,PAPUA NEW GUINEA,,,"Foot severely bitten, surgically amputated",N
4531,1940.12.28,28-Dec-40,Unprovoked,AUSTRALIA,New South Wales,Standing on sandbank,"FATAL, injuries to lower back ",Y
4532,1940.12.20,20-Dec-40,Unprovoked,SOUTH AFRICA,KwaZulu-Natal,Swimming,"FATAL, multiple injuries to legs & buttocks ",Y
4533,1940.12.19.R,Reported 19-Dec-1940,Unprovoked,AUSTRALIA,Queensland,Fishing,Minor injury to leg,N
4534,1940.12.10,10-Dec-40,Provoked,AUSTRALIA,Northern Territory,Collecting fish in military trap when bitten by captured shark that had been shot by soldiers with Garten,Leg severely lacerated PROVOKED INCIDENT,N
4535,1940.09.00,Sep-40,Unprovoked,PANAMA,Panama Bay (Pacific Ocean),Bathing,FATAL,Y
4536,1940.07.13.b,13-Jul-40,Unprovoked,USA,South Carolina,Standing,Ankle bitten,N
4537,1940.07.13.a,13-Jul-40,Unprovoked,USA,South Carolina,Standing ,Struck by shark immediately before it bit Tanner (see below),N
4538,1940.06.30,30-Jun-40,Unprovoked,USA,North Carolina,Fishing,Thigh lacerated,N
4539,1940.03.31,31-Mar-40,Unprovoked,SOUTH AFRICA,KwaZulu-Natal,Treading water,"FATAL, right thigh & calf bitten ",Y
4540,1940.03.20,20-Mar-40,Unprovoked,AUSTRALIA,New South Wales,Free diving for lobster,Minor injuries to foot,N
4541,1940.02.22,22-Feb-40,Unprovoked,SOUTH AFRICA,KwaZulu-Natal,Swimming,"FATAL, left thigh & knee bitten ",Y
4542,1940.02.20,20-Feb-40,Boating,AUSTRALIA,New South Wales,Canoeing,"No injury. Shark grazed canoe, snapped at a piece of mast being trailed in the water & followed it into 2' of water",N
4543,1940.02.04,04-Feb-40,Unprovoked,AUSTRALIA,New South Wales,Wading,"FATAL, injuries to both arms  ",Y
4544,1940.01.29,29-Jan-40,Unprovoked,AUSTRALIA,Queensland,Dived into the water,Shoulder nipped,N
4545,1940.01.23,23-Jan-40,Unprovoked,AUSTRALIA,New South Wales,Swimming,"FATAL, left leg severed  ",Y
4546,1940.01.15,15-Jan-40,Unprovoked,AUSTRALIA,Queensland,Swimming,Chest lacerated,N
4547,1940.01.07,07-Jan-40,Unprovoked,SOUTH AFRICA,KwaZulu-Natal,Swimming ,"FATAL, leg & thigh bitten  ",Y
4548,1940.01.01,01-Jan-40,Unprovoked,AUSTRALIA,Queensland,Diving for trochus,Thigh  lacerated,N
4549,1940.00.00.f,Ca. 1940,Boating,SLOVENIA,Adriatic Sea,Boating,"No inury to occupants, shark struck boat",N
4550,1940.00.00.e,1940,Unprovoked,NEW GUINEA,Bwagaoia,,FATAL,Y
4551,1940.00.00.d,1940,Unprovoked,PAPUA NEW GUINEA,Western Papuan Gulf,male,Hand bitten,N
4552,1940.00.00.c,1940,Invalid,SOUTH AFRICA,Eastern Cape Province,Swimming,No details,UNKNOWN
4553,1940.00.00.b,1940,Invalid,SOUTH AFRICA,KwaZulu-Natal,,FATAL,Y
4554,1940.00.00.a,1940,Invalid,SOUTH AFRICA,Eastern Cape Province,Standing in water with child in her arms,Leg bitten,N
4555,1939.12.28,28-Dec-39,Invalid,AUSTRALIA,New South Wales,Swimming,Abrasion above knee ,N
4556,1939.12.14,14-Dec-39,Unprovoked,AUSTRALIA,Queensland,Swimming ,"FATAL, left foot & right leg bitten, later surgically amputated  ",Y
4557,1939.11.23,23-Nov-39,Boating,AUSTRALIA,New South Wales,,No injury,N
4558,1939.11.11,11-Nov-39,Provoked,AUSTRALIA,New South Wales,,Boat bitten by gaffed shark PROVOKED INCIDENT,N
4559,1939.11.09,09-Nov-39,Boating,AUSTRALIA,New South Wales,,No details,UNKNOWN
4560,1939.11.06,06-Nov-39,Boating,AUSTRALIA,New South Wales,,No details,UNKNOWN
4561,1939.11.02.R,Reported 02-Nov-1939,Unprovoked,SAMOA,,Fishing,FATAL,Y
4562,1939.10.25.R,Reported 25-Oct-1939,Unprovoked,AUSTRALIA,Queensland,"Free diving for trochus shell, swimming to dinghy","Both thighs were lacerated, recovered at Thursday Island hospital",N
4563,1939.10.04,04-Oct-39,Unprovoked,USA,Hawaii,Spearfishing & had just speared a ulua,Hand bitten,N
4564,1939.09.27.R,Reported 27-Sep-1939,Unprovoked,AUSTRALIA,Torres Strait ,Pearl diving,"Leg severely bitten, surgically amputated",N
4565,1939.08.01,01-Aug-39,Provoked,USA,California,Fishing,Harpooned shark bit his arm PROVOKED INCIDENT,N
4566,1939.07.18,18-Jul-39,Sea Disaster,PACIFIC OCEAN,,Japanese freighter Bokuyo Maru burned & sank,Thought to have been taken by a shark,Y
4567,1939.07.16,16-Jul-39,Provoked,BAHAMAS,Andros Islands,"Dress diving, filming shark & pulling it through the water for a motion picture scene",Minor injury to shoulder & back PROVOKED INCIDENT,N
4568,1939.07.14,14-Jul-39,Provoked,USA,Texas,Seine netting,Leg bitten by snared shark PROVOKED INCIDENT,N
4569,1939.05.03,03-May-39,Unprovoked,USA,Virginia,Washed off freighter Huncliff by a freak wave,"FATAL, attacked by shark, body not recovered ",Y
4570,1939.04.12.R,12-Apr-39,Unprovoked,PAPUA NEW GUINEA,Morobe Province,Dived for a coin,FATAL,Y
4571,1939.03.24,24-Mar-39,Unprovoked,PAPUA NEW GUINEA,Central Province,Dived for a coin,"FATAL, leg severed just below hip ",Y
4572,1939.02.26,26-Feb-39,Provoked,NEW ZEALAND,North Island,Fishing,Lacerations to left hand from hooked shark PROVOKED INCIDENT,N
4573,1939.01.12,12-Jan-39,Unprovoked,AUSTRALIA,New South Wales,Scooping prawns,No injury,N
4574,1939.00.00.e,Woirld War II,Sea Disaster,SRI LANKA,,She was on a ship that was torpedoes & was in the water awaiting rescue,Leg severely bitten,N
4575,1939.00.00.d,Ca. 1939,Boating,BAHAMAS,Andros Islands,Fishing,"No injury to occupant, shark rammed bow of boat",N
4576,1939.00.00.c,1939,Unprovoked,VENEZUELA,Carabobo,Bathing,FATAL.,Y
4577,1939.00.00.b,1939,Unprovoked,CURACAO,Ascension Bay,Diving,"No injury, left hip bumped by shark",N
4578,1939.00.00.a,1939,Unprovoked,PAPUA NEW GUINEA,"Abau Sub District, Central Province",Swimming to anchored boat,"Fatal, lower abdomen bitten",Y
4579,1938.12.27,27-Dec-38,Unprovoked,AUSTRALIA,New South Wales,Swimming,"FATAL, thought to have been taken by a shark ",Y
4580,1938.10.05,05-Oct-38,Provoked,AUSTRALIA,Queensland,Fishing,Laceration to left foot & ankle by netted shark PROVOKED INCIDENT,N
4581,1938.08.29,29-Aug-38,Unprovoked,CHINA,North China,Swimming alongside warship   Tsingt-ao,"FATAL, leg severed  ",Y
4582,1938.08.18,18-Aug-38,Provoked,USA,California,Fishing,Lacerations to hand by hooked shark PROVOKED INCIDENT,N
4583,1938.07.18,18-Jul-38,Unprovoked,USA,South Carolina,Swimming,Foot & ankle lacerated,N
4584,1938.07.17.R,Reported 17-Jul-1938,Provoked,TURKEY,,Fishing,Injured by harpooned shark PROVOKED INCIDENT,N
4585,1938.07.17,17-Jul-38,Provoked,USA,California,"Fishing, removing gaff from shark's mouth",Leg bitten by gaffed shark PROVOKED INCIDENT,N
4586,1938.07.12,12-Jul-38,Unprovoked,AUSTRALIA,Torres Strait,"Hardhat diving from Japanese pearling lugger, Reiyo Maru","FATAL, dragged out of diving helmet  ",Y
4587,1938.06.17,17-Jun-38,Unprovoked,NICARAGUA,Lower San Juan River,"The schooner Elizabeth, bound from Bluefields, Nicaragua to the river port of San Carlos foundered","FATAL x 2, all other passengers & crew reached shore after a long swim",Y
4588,1938.06.08,08-Jun-38,Unprovoked,AUSTRALIA,New South Wales,Hardhat diving,"No injury, the shark knocked him off his feet",N
4589,1938.05.26,26-May-38,Unprovoked,COSTA RICA,Nicoya Peninsula,Fishing,"FATAL, pulled overboard by tuna, & bitten by shark ",Y
4590,1938.05.15,15-May-38,Unprovoked,IRAQ,Basrah City,"Swimming, naked","Arm severed, but survived. Note: Some weeks later he was swimming at the same spot when a shark severed his right foot.",N
4591,1938.05.02.R,Reported 02-May-1938,Unprovoked,INDIA,West Bengal,Bathing,"2 survived,       1 FATAL",Y
4592,1938.03.21.R,Reported 21-Mar-1938,Unprovoked,FIJI,Viti Levu,Wading,unknown,N
4593,1938.03.08,08-Mar-38,Unprovoked,AUSTRALIA,Northern Territory,Canoe capsized by shark,"Leg severed, but survived",N
4594,1938.01.21,21-Jan-38,Provoked,AUSTRALIA,New South Wales,Fishing,Thumb bitten by landed shark PROVOKED INCIDENT,N
4595,1938.01.18,18-Jan-38,Provoked,SOUTH AFRICA,KwaZulu-Natal,"Watching seine netters with friends, one of whom picked up a netted shark",Leg bitten PROVOKED INCIDENT,N
4596,1938.01.14,14-Jan-38,Unprovoked,AUSTRALIA,New South Wales,Diving off jetty,Superficial lacerations on feet & toes,N
4597,1938.01.02,02-Jan-38,Unprovoked,AUSTRALIA,New South Wales,Surf skiing,"No injury, ski bumped & he was thrown in the water. Ski had indentations",N
4598,1938.00.00.e.R,Reported 1938,Unprovoked,EGYPT,,Sponge diving,FATAL,Y
4599,1938.00.00.d,1938,Unprovoked,TRINIDAD & TOBAGO,Trinidad,Body surfing,Left hand and arm bitten,N
4600,1938.00.00.c,1938,Provoked,USA,North Carolina,Fishing,"No injury, boat towed by harpooned shark, PROVOKED INCIDENT",N
4601,1938.00.00.b,1938,Unprovoked,AUSTRALIA,Torres Strait,Diving,Leg severed above knee,N
4602,1938.00.00.a,1938,Unprovoked,SOUTH AFRICA,KwaZulu-Natal,Swimming,"""Mauled""",N
4603,1937.11.13,13-Nov-37,Sea Disaster,USA,North Carolina,"Tzenny Chandris, a Greek freighter laden with scrap iron, foundered in heavy weather",FATAL ,Y
4604,1937.11.11,11-Nov-37,Unprovoked,AUSTRALIA,Torres Strait ,Diving for trochus,FATAL,Y
4605,1937.11.06.R,Reported 06-Nov-1937,Sea Disaster,SOLOMON ISLANDS,,"Two canoes with 14 aboard blown to sea in a storm. While adrift for 3 week, one person fell overboard and was killed by a shark",FATAL,Y
4606,1937.10.27.b,27-Oct-37,Unprovoked,AUSTRALIA,Queensland ,Swimming ,FATAL,Y
4607,1937.10.27.a,27-Oct-37,Unprovoked,AUSTRALIA,Queensland,Swimming ,FATAL,Y
4608,1937.10.24.c,24-Oct-37,Unprovoked,AUSTRALIA,New South Wales,Swimming near jetty,Tooth imprints on torso,N
4609,1937.10.24.a,24-Oct-37,Unprovoked,AUSTRALIA,New South Wales,Surf skiing,"No injury, repulsed shark",N
4610,1937.09.26.R,Reported 26-Sep-t937,Provoked,CROATIA, Split-Dalmatia County,Fishing,Injured by shark they were trying to catch PROVOKED INCIDENT,N
4611,1937.09.12,12-Sep-37,Boating,SCOTLAND,Argyllshire,Pleasure boating,"No injury to occupants, two 5-foot observation windows shattered",N
4612,1937.09.11,11-Sep-37,Boating,SCOTLAND,Arran,Fishing,"No injury to occupants, propeller shaft damaged",N
4613,1937.09.01,01-Sep-37,Unprovoked,SCOTLAND,Argyll,Rowing,3 people drowned when the boat was capsized by the shark,N
4614,1937.08.31,31-Aug-37,Unprovoked,AUSTRALIA,Torres Strait,"Diving from the lugger San, operated by the Protector of the Aborigines","Head, neck & shoulder bitten (In 1918, he was also bitten by a shark off Cairns)",N
4615,1937.08.16,16-Aug-37,Invalid,TURKEY,,Swimming,"No injury, no attack",N
4616,1937.08.02,02-Aug-37,Unprovoked,PANAMA,Colon Province,Swimming,FATAL,Y
4617,1937.07.16.R,Reported 16-Jul-1937,Unprovoked,AUSTRALIA,Northern Territory,Pearl diving,FATAL,Y
4618,1937.07.06,07-Jul-37,Invalid,ITALY,Liguria,,No injury,N
4619,1937.06.28.R,Reported 28-Jun-1937,Unprovoked,GREECE,,,FATAL,Y
4620,1937.06.15.b,15-Jun-37,Provoked,AUSTRALIA,New South Wales,"Fishing from launch, fell into net with shark",Bitten by netted shark PROVOKED INCIDENT,N
4621,1937.06.15,    15-Jun-1937,Unprovoked,USA,Texas,Swimming,FATAL,Y
4622,1937.05.30,30-May-37,Provoked,USA,Texas,Fishing,Leg nipped by hooked shark PROVOKED INCIDENT,N
4623,1937.05.15,15-May-37,Unprovoked,AUSTRALIA,Queensland,"Refused permission to cross on the ferry, he was swimming across the river","FATAL, left arm severed at elbow, right arm bitten, right leg severed at knee    ",Y
4624,1937.03.26,26-Mar-37,Invalid,AUSTRALIA,New South Wales,Bathing,His body was recovered 2 days later but shark involvement prior to death was not confirmed,N
4625,1937.03.09,09-Mar-37,Invalid,AUSTRALIA,Victoria,Swimming,Shark involvement prior to death was not confirmed,Y
4626,1937.02.13,13-Feb-37,Unprovoked,AUSTRALIA,New South Wales,Swimming,"FATAL, buttocks, ankle & right elbow bitten ",Y
4627,1937.02.11,11-Feb-37,Unprovoked,AUSTRALIA,New South Wales,Swimming ashore after launch capsized,Foot bitten,N
4628,1937.02.04,04-Feb-37,Boating,AUSTRALIA,New South Wales,Fishing,"No injury to occupants, launch holed",N
4629,1937.02.03,03-Feb-37,Provoked,AUSTRALIA,Queensland,Fishing,Left shoulder bitten by netted shark PROVOKED INCIDENT,N
4630,1937.02.02,1937,Invalid,AUSTRALIA,South Australia,12 of the Penang's crew were returning to the ship when their 12' dinghy capsized,Shark involvement prior to death was not confirmed,Y
4631,1937.01.27,27-Jan-37,Provoked,AUSTRALIA,New South Wales,Holding shark's tail ,Bitten on forearm PROVOKED INCIDENT,N
4632,1937.00.00,1937,Unprovoked,AUSTRALIA,Torres Strait,,Survived,N
4633,1936.12.30,30-Dec-36,Unprovoked,USA,Hawaii,"Diving, attempting to retrieve body of drowning victim wedged between rocks",Thigh lacerated,N
4634,1936.12.19,19-Dec-36,Boating,AUSTRALIA,Queensland,Sculling,"No injury to occupant. Shark damaged scull, tooth fragments recovered",N
4635,1936.12.15,15-Dec-36,Provoked,AUSTRALIA,New South Wales,Fishing for the shark that killed George Lundberg,Hooked shark bit rudder PROVOKED INCIDENT,N
4636,1936.12.12,12-Dec-36,Unprovoked,AUSTRALIA,New South Wales,Swimming,"FATAL, leg severed at knee",Y
4637,1936.12.01,01-Dec-36,Boating,AUSTRALIA,Victoria,Fishing,"FATAL, his 2.4 m dinghy was found with 2' x 3' hole in its side & tooth fragments embedded in the planking",Y
4638,1936.11.27,27-Nov-36,Provoked,AUSTRALIA,Torres Strait,Spearfishing ,Speared shark bit his hand PROVOKED INCIDENT,N
4639,1936.09.04,04-Sep-36,Unprovoked,USA,Hawaii,Swimming,Leg lacerated,N
4640,1936.08.24,24-Aug-36,Unprovoked,AUSTRALIA,Torres Strait,"Trochus diving, but floating on surface",Flexed right leg bitten,N
4641,1936.08.11,11-Aug-36,Provoked,CANADA,Newfoundland,Fishing for cod,"No injury to occupants, hooked shark leapt onboard boat PROVOKED INCIDENT",N
4642,1936.08.04,Reported 04-Aug-1936,Unprovoked,AUSTRALIA,Torres Strait,Pearl diving,Torso bitten ,N
4643,1936.08.00,Aug-36,Boating,USA,North Carolina,Fishing,Shark rammed boat; no injury to occupants,N
4644,1936.07.25,25-Jul-36,Unprovoked,USA,Massachusetts,Swimming crawl stroke,"FATAL, finger severed, thigh bitten He died during the surgical amputation of his leg   ",Y
4645,1936.07.12,12-Jul-36,Boating,USA,New Jersey,Fishing for bluefish,"No injury to occupants, shark leapt onboard boat",N
4646,1936.07.07,07-Jul-36,Unprovoked,AUSTRALIA,Torres Strait,Diving,Survived? Admitted to Thursday Island Hospital,N
4647,1936.07.00,Jul-36,Boating,SOUTH AFRICA,Western Cape Province,"Fishing, catching snoek, Thyrsites atun","Shark leapt onboard & into fishwell, tossing a crew member, Pepino, in the sea",N
4648,1936.06.26,26-Jun-36,Unprovoked,AUSTRALIA,Torres Strait,"Diving for trochus , but swimming on surface",FATAL,Y
4649,1936.06.06,06-Jun-36,Unprovoked,USA,Florida,Swimming,FATAL,Y
4650,1936.04.22,22-Apr-36,Unprovoked,AUSTRALIA,Queensland,Diving for trochus,"Arm & back bitten, heel lacerated",N
4651,1936.04.08,08-Ap-1936,Unprovoked,AUSTRALIA,Queensland,Diving,Arm severed,N
4652,1936.03.30,30-Mar-36,Provoked,USA,Florida,Fishing,No injury. His hand entangled in line of hooked shark. He was pulled overboard & towed 150' PROVOKED INCIDENT ,N
4653,1936.03.22,12-Mar-36,Unprovoked,AUSTRALIA,Torres Strait,Among 31 survivors of crew from the sampan Fukulya Maru (which reached Thursday Island in rowing boat) was a man whose arm had been bitten off by shark. The sampan wrecked west of McArthur island ,Survived,N
4654,1936.03.19,19-Mar-36,Unprovoked,AUSTRALIA,Queensland,Diving for trochus,Right forearm lacerated,N
4655,1936.03.04.,04-Mar-36,Boating,AUSTRALIA,Northern Territory,Rowing ,"No injury to occupants, shark almost wrenched oar from aborigine",N
4656,1936.02.23,23-Feb-36,Provoked,AUSTRALIA,New South Wales,Touching the mouth of a supposedly dead shark,Finger bitten PROVOKED INCIDENT,N
4657,1936.02.20..R,Reported 20-Feb-1936,Unprovoked,AUSTRALIA,Queensland,Sculling,"No injury, scull sank",N
4658,1936.02.04,04-Feb-36,Unprovoked,AUSTRALIA,New South Wales,Swimming,"FATAL, taken by shark, body not recovered. Twenty months later, in October 1937, meshing (setting anti-shark gill nets) began  at metropolitan beaches",Y
4659,1936.01.22,22-Jan-36,Unprovoked,AUSTRALIA,South Australia,"Swimming. Passer-by, Len Bedford, heard him shriek , saw shark leap from the water & swimmer disappeared",FATAL ,Y
4660,1936.01.05,05-Jan-36,Invalid,AUSTRALIA,Queensland,Surfing,Disappeared & his torn clothing washed ashore,N
4661,1936.01.00,Jan-36,Provoked,AUSTRALIA,New South Wales,Paddleskiing,"He tried to hit shark with paddle, shark bumped  ski  PROVOKED INCIDENT",N
4662,1936.00.00,1936,Unprovoked,AUSTRALIA,Victoria ,Swimming ,FATAL ,Y
4663,1935.12.23,23-Dec-35,Provoked,AUSTRALIA,Victoria,Cruising,"Harpooned shark stove in bow (20"" x 10"" hole), boat sank PROVOKED INCIDENT",N
4664,1935.11.13,13-Nov-35,Unprovoked,AUSTRALIA,Torres Strait,Diving?,Back & arm gashed but survived,N
4665,1935.09.21,21-Sep-35,Unprovoked,USA,North Carolina,Swimming,"FATAL, thigh bitten ",Y
4666,1935.09.04.R,Reported 04-Sep-1935,Unprovoked,PAPUA NEW GUINEA,Central Province,Swimming,FATAL,Y
4667,1935.08.26,26-Aug-35,Unprovoked,AUSTRALIA,Queensland,"Fell overboard, hanging onto lifebuoy","FATAL. His body was not recovered, but about 3 weeks later 2 sharks were caught with human remains, thought to be those of Quinn",Y
4668,1935.08.24,24-Aug-35,Invalid,UNITED KINGDOM,Isle of Wight,Fishing,"The hooked shark didn't cut his finger, he was injured by his line",N
4669,1935.08.13,13-Aug-35,Unprovoked,AUSTRALIA,Torres Strait,Diving for beche-de-mer from lugger,"FATAL, right buttock & thigh bitten ",Y
4670,1935.07.27.b,27-Jul-35,Invalid,USA,California,fishing boat exploded & sank,"Although listed as an uprovoked fatal attack by SAF, shark bite on his ankle was post-mortem following death by drowning",Y
4671,1935.07.27.a,27-Jul-35,Invalid,USA,California,fishing boat exploded & sank,"Although listed as  an uprovoked fatal attack by SAF, he was killed by the explosion. The shark bites were post-mortem ",Y
4672,1935.07.05,05-Jul-35,Unprovoked,PANAMA,,"Fishing with dynamite, afterwards in water retrieving catch","FATAL, leg severed ",Y
4673,1935.07.01,01-Jul-35,Unprovoked,CROATIA,Adriatic Sea,Swimming,FATAL,Y
4674,1935.06.18,18-Jun-35,Unprovoked,USA,New Jersey,"Fishing for bluefish, shark leapt into dory",Arm lacerated by a shark that leapt onto boat ,N
4675,1935.06.05.R,Reported 05-Jun-1935,Unprovoked,SOLOMON ISLANDS,Makira-Uluwa Province,Fishing,FATAL,Y
4676,1935.06.00.b,Jun-35,Boating,AUSTRALIA,South Australia,,Shark bumped dinghy twice,N
4677,1935.06.00.a,Jun-35,Unprovoked,PAPUA NEW GUINEA,Northern (Oro) Province,,"Samoan missionary, Filemani, caught an 8'6"" shark after it had killed 1 man & 2 boys in space of few weeks",N
4678,1935.05.19,19-May-35,Provoked,SOUTH AFRICA,KwaZulu-Natal,Put foot inside a landed & supposedly dead shark,"Foot bitten, required 1 week hospitalization PROVOKED INCIDENT",N
4679,1935.05.12,12-May-35,Unprovoked,AUSTRALIA,Torres Strait,Pearl diving,3 gashes on hand & wrist,N
4680,1935.04.25,25-Apr-35,Invalid,AUSTRALIA,New South Wales,"Disappeared 11 days earlier, probable homicide victim",Captive shark regurgitated his arm in the Coogee Aquarium,N
4681,1935.04.12.R,Reported 12-Apr-1935,Unprovoked,,,Diving,Laceration to left leg,N
4682,1935.04.08.R,Reported 08-Apr-1935,Unprovoked,USA,California,,Laceration to hand  ,N
4683,1935.03.30,30-Mar-35,Unprovoked,AUSTRALIA,Queensland,Diving from dinghy for trochus shell,Buttocks injured by fin or a bump ,N
4684,1935.03.25.R,Reported 25-Mar-1935,Provoked,SOUTH AFRICA,KwaZulu-Natal,Put foot inside mouth of supposedly dead shark,Injury to foot    PROVOKED INCIDENT,N
4685,1935.03.20,20-Mar-35,Unprovoked,AUSTRALIA,Torres Strait,"Pearl diving, but standing in the water",Left thigh abraded & 3 fingers lacerated,N
4686,1935.03.13,13-Mar-35,Provoked,AUSTRALIA,Queensland,Hauling in net with shark in it,Calf & shin bitten  PROVOKED INCIDENT,N
4687,1935.03.11,11-Mar-35,Unprovoked,AUSTRALIA,New South Wales,Surfing,Abrasions to shins,N
4688,1935.03.09,09-Mar-35,Unprovoked,AUSTRALIA,New South Wales,Swimming,"FATAL, left thigh, buttock, left forearm bitten, finger removed  ",Y
4689,1935.03.02,02-Mar-35,Unprovoked,AUSTRALIA,New South Wales,Standing,"FATAL, thigh bitten ",Y
4690,1935.02.14,14-Feb-35,Unprovoked,AUSTRALIA,New South Wales,Surfing (pneumatic surfboard),"Thigh lacerated, abrasions",N
4691,1935.01.24.b,24-Jan-35,Unprovoked,AUSTRALIA,New South Wales,Fishing,"No injury, sleeve ripped",N
4692,1935.01.24.a,24-Jan-35,Boating,AUSTRALIA,Queensland,Fishing for sharks,No injury to occupants,N
4693,1935.01.21.R,Reported 21-Jan-1935,Invalid,ISRAEL,Herzliyah,,human remains washed ahore,F
4694,1935.01.17,17-Jan-35,Invalid,AUSTRALIA,Queensland,,No injury; onlookers saw shark heading for him and lifted him ashore,N
4695,1934.12.31.b,31-Dec-34,Unprovoked,AUSTRALIA,New South Wales,Splashing,Hands severed,N
4696,1934.12.31.a,31-Dec-34,Unprovoked,AUSTRALIA,New South Wales,Swimming (lead swimmer in race),"FATAL, left leg bitten ",Y
4697,1934.12.23.b,23-Dec-34,Unprovoked,AUSTRALIA,New South Wales,Taken as he dived into the water,FATAL,Y
4698,1934.12.23.a,23-Oct-34,Unprovoked,AUSTRALIA,New South Wales,Swimming & splashing,Leg injured,N
4699,1934.10.09,09-Oct-34,Unprovoked,AUSTRALIA,Northern Territory,Bathing,FATAL,Y
4700,1934.10.08,08-Oct-34,Provoked,BERMUDA,Hamilton,Fishing,Arm bitten by hooked shark PROVOKED INCIDENT,N
4701,1934.10.02,22-Oct-34,Unprovoked,AUSTRALIA,Torres Strait,Freediving for trochus shell (submerged),"FATAL, forearm lacerated & surgically amputated, but died of gas gangrene 13 days afterwards ",Y
4702,1934.09.08,08-Sep-34,Provoked,BERMUDA,Hamilton,Fishing,Right foot bitten by shark caught & taken onboard  by Mrs. Tucker North PROVOKED INCIDENT,N
4703,1934.08.27,27-Aug-34,Boating,ITALY,Sicily,Fishing on a boat,No injury to occupants,N
4704,1934.08.26.R,Reported 26-Aug-1934,Invalid,ITALY / CROATIA,,Swimming,"Reported  to be FATAL, but found to be a false report; there was no attack",N
